{
  "amendments": [],
  "analysis_code_revision": "<<FILL>>: see run manifest code_revision",
  "conditions": [
    {
      "author_blind_to_genomes": null,
      "condition_id": "A",
      "controls_confound": null,
      "description": "K0 baseline, sexpr projection, verifier loop fixed",
      "genome_id": "G-A",
      "human_authored": false,
      "introduces_new_semantics": false,
      "role": "reference"
    },
    {
      "author_blind_to_genomes": null,
      "condition_id": "R1",
      "controls_confound": "C2_compression",
      "description": "identical semantics, compact projection (compression ratio ~1.6)",
      "genome_id": "G-R1",
      "human_authored": false,
      "introduces_new_semantics": false,
      "role": "confound_control"
    },
    {
      "author_blind_to_genomes": null,
      "condition_id": "R2",
      "controls_confound": "C2_compression",
      "description": "identical semantics, a further-shortened projection (compression ratio target ~2.2)",
      "genome_id": "G-R2",
      "human_authored": false,
      "introduces_new_semantics": false,
      "role": "confound_control"
    },
    {
      "author_blind_to_genomes": null,
      "condition_id": "R3",
      "controls_confound": "C2_compression",
      "description": "identical semantics, a deliberately verbose projection (compression ratio ~0.7)",
      "genome_id": "G-R3",
      "human_authored": false,
      "introduces_new_semantics": false,
      "role": "confound_control"
    }
  ],
  "declared_outcome_interpretations": {
    "efficiency_only": "token savings reported per arm as efficiency, by construction never as capability",
    "h0_consistent": "positive r with CI excluding 0 -> H13 refuted; compression must be treated as a candidate capability lever in later designs",
    "null_result": "not applicable: a flat correlation is the confirmatory outcome here",
    "positive": "|r| <= 0.1 with CI including 0 -> H13 supported: compression and capability decouple"
  },
  "evaluator_image_digest": "<<FILL>>: the image digest the run executes under (ADR-0005)",
  "exclusion_criteria": [
    "sandbox crash",
    "evaluator image mismatch",
    "ledger corruption",
    "a fatal transcript leak finding (canary or sealed input on a model-visible surface): the run is aborted and the finding recorded, never a silent exclusion",
    "Exclusion for unfavourable results is prohibited; all exclusions listed with cause."
  ],
  "experiment_id": "EXP-005",
  "exploratory_endpoints": [
    "per_compute_curve"
  ],
  "kernel_version": "K0-1.0.0",
  "minimum_interesting_effect": {
    "expected_correlation_r": 0.0,
    "h13_confirmed_if_abs_r_at_most": 0.1,
    "h13_refuted_if": "positive r whose 95% CI excludes 0",
    "note": "H13 (compression is not capability), designed on the vericoding template: natural-language descriptions add nothing, the loop adds everything. Hold the K0 verifier loop fixed, vary only compressibility."
  },
  "model_identity": {
    "claim_limitation": "the model role is a fixed-weights language model (ADR-0022); results are Claim Level 1 at most until the evaluator is containerised and the assets relocated (ADR-0005)",
    "constrained_decoding": false,
    "context_budget_tokens": "<<FILL>>",
    "kind": "fixed_weights_llm",
    "logprob_access": "<<FILL>>",
    "mode": "fixed-weights",
    "model_id": "<<FILL>>",
    "model_identity_hash": "<<FILL>>: ModelIdentity.hash() of the record above",
    "parameter_count": "<<FILL>>",
    "provider": "<<FILL>>",
    "sampling": {
      "max_output_tokens": "<<FILL>>",
      "seed_policy": "per (seed, task, sample) hash",
      "temperature": "<<FILL>>"
    },
    "supported_projections": [
      "sexpr",
      "compact"
    ],
    "tokenizer_id": "<<FILL>>",
    "tool_interface": "none",
    "weights_digest": "<<FILL>>: sha256 of the weights, or the provider's immutable snapshot id"
  },
  "multiple_comparison_control": {
    "family": [
      "generation_tokens",
      "parse_failure_rate",
      "twin_gap"
    ],
    "level": 0.05,
    "method": "benjamini_hochberg"
  },
  "power_analysis": {
    "achieved_power": "<<FILL>>",
    "alpha": 0.05,
    "framing": "superiority",
    "powered": false,
    "required_seeds": "<<FILL>>",
    "target_power": 0.8,
    "variance_estimate": "<<FILL>>",
    "variance_source_run": "<<FILL>>: E0 re-measured under the model (Exp001Runner.stage_s1 with the model spec)"
  },
  "preregistration_hash": "",
  "primary_endpoint": "correlation between compression_ratio and verified_ood_solve_rate at fixed FLOPs across projection arms with identical semantics and a fixed verifier loop",
  "secondary_endpoints": [
    "generation_tokens",
    "parse_failure_rate",
    "twin_gap"
  ],
  "seeds_per_condition": 1,
  "stopping_rule": "Fixed: <<FILL>> seeds per condition (from the power analysis), all conditions run to completion. No interim analysis, no data-dependent stopping. Aborted runs are recorded with their cause, never silently discarded.",
  "timestamp_utc": ""
}
